video_id,user_id,title,description,upload_date,video_url,thumbnail_url,views_count
21,14,Majority seek former project cut road line.,"Race anyone watch value discussion. Could fill maintain me.
Cultural right their skill. Little memory go beautiful such almost other.",2023-09-06,https://mccoy.com/,https://picsum.photos/85/121,608429
22,19,Health can teacher understand possible least.,"Ability enter much nice building part treatment. Break some best others paper. Book Republican dream listen have.
Way draw study heart yard middle laugh well. Letter story trade.",2024-01-09,https://www.christian.com/,https://placekitten.com/337/404,995116
23,19,For strategy police themselves professional.,Cost level including government. Sort soldier moment according detail record. Enough sure sing newspaper community control debate.,2023-07-09,https://jackson.com/,https://placekitten.com/135/256,649989
24,16,So bed stay single.,No serve look a wide read. Community hold technology sister news table point. Professor term technology PM hand agree buy.,2024-03-14,http://www.dean.biz/,https://picsum.photos/321/871,592649
25,19,Girl worker choose cup.,"Whole kid expert couple million large protect. Growth wall set blue behind. Charge small fast according outside.
Hit concern reach rise television.",2023-08-12,https://pitts-mccann.com/,https://placekitten.com/394/87,113470
26,17,Possible air computer now.,"Discussion stand upon weight admit significant tell. Art person song own right.
That guy top age. Push station like also focus old property. When music about event fear when issue born.",2023-09-14,http://powers.com/,https://dummyimage.com/169x239,958733
27,15,Baby author season specific.,"Rule break career pattern. Beautiful concern trouble between personal any.
Color several action too. Family source seat on important only understand. Cover newspaper government Mr bring trouble.",2024-04-09,http://www.cohen.net/,https://dummyimage.com/255x548,186296
28,15,Policy factor today agree evidence where lay.,Business step nothing southern total word study force. Per quite economy full.,2023-12-19,http://www.cooper.com/,https://picsum.photos/859/43,148345
29,12,Speech consumer many water say.,"Customer she smile across evening because. Still suggest operation their.
Population traditional interview into say. Eye same spring street behind into PM. Free if season site fly.",2023-11-16,http://stewart.net/,https://placekitten.com/433/640,2547
30,20,Tree activity Republican reveal.,By food draw. To night ahead market adult than. Success too popular anything. During beat black.,2024-05-29,http://holmes.biz/,https://picsum.photos/278/893,172951
31,15,Kitchen party staff heart some remain.,"Set news PM factor. Serve why soldier surface reality coach better.
Can sit expect play his and.
Local early add mother mouth tell pay forget. Team popular reveal. Adult begin particular for.",2023-09-14,https://simmons.com/,https://dummyimage.com/467x995,54595
32,15,Seem fish true case stock.,Develop send gas address hit describe. Cold realize practice star same without debate. Still discussion detail system line school.,2023-06-09,https://ruiz.com/,https://placekitten.com/22/223,782888
33,18,Watch wind follow final.,"Interesting purpose alone for. Image machine your computer.
Truth behavior care bank maybe. None now identify buy election challenge live. Hand law ground general however Congress language.",2024-05-03,https://ryan.biz/,https://placekitten.com/804/846,683401
34,14,Nearly industry few task economic protect factor phone.,"Down exactly southern happen task. Against current fast water.
Music out happy participant market cell language whole. Be development clearly once investment fight both race.",2024-01-05,https://www.green-garcia.net/,https://placekitten.com/379/88,984647
35,19,Experience deal which of main.,Like ask officer every strong state hospital relate. Fall meet bring rate detail particular. Where hotel he growth agreement station court.,2024-02-06,http://brown-rose.org/,https://placekitten.com/4/118,979391
36,16,Church under person wall.,"Next south where high community tend less. Generation continue house stage place. Ever Mrs partner win.
Pretty plan now next. Knowledge find blood first life sort.",2024-02-12,http://nunez-washington.com/,https://dummyimage.com/52x558,244272
37,13,Threat me her husband never.,"Unit street listen forget should.
Really if collection class whether no Mrs. Appear identify few sing second all industry. Model maintain democratic.",2023-07-10,https://www.mooney.com/,https://dummyimage.com/882x188,924949
38,12,Senior process another plant expert either.,"Blue campaign professional near young huge national.
Nice data drop value. Stage me according big born include.",2024-03-21,http://lucero.com/,https://placekitten.com/796/63,772287
39,15,Car travel truth during growth price himself.,Provide probably him economic radio make clear. Cause real affect model model specific media. Particularly field attention quite capital.,2024-01-17,https://www.johns.net/,https://picsum.photos/729/48,28124
40,13,Try baby save.,"Also man expert dream husband. Those quality everyone western hard.
Prove administration before never future. Put pattern almost help because kid range. Tough his laugh if.",2023-07-17,http://rodriguez.org/,https://picsum.photos/598/294,800237
